<?xml version="1.0" encoding="UTF-8"?><accounts xmlns:xsi="http://www.w3.org/2001/XMLSchema-instance" xmlns="http://epam.vsu.by/final-project-example/accounts" xsi:schemaLocation="http://epam.vsu.by/final-project-example/accounts accounts.xsd"><account><id>1</id><name>Иванов</name><balance>1234</balance></account><account><id>2</id><name>Петров</name><balance>11111</balance></account></accounts>